models/tri_attention/TriAttentionCache/2/_attention_fwd_8-9.json
{
    "4_32_256_torch.bfloat16_torch.bfloat16_torch.bfloat16_torch.bfloat16_torch.bfloat16_torch.bfloat16_torch.float32": {
        "kwargs": {
            "BLOCK_M": 64,
            "BLOCK_N": 32
        },
        "num_warps": 2,
        "num_stages": 3
    },
    "4_32_256_torch.float32_torch.float32_torch.float32_torch.float32_torch.float32_torch.float32_torch.float32": {
        "kwargs": {
            "BLOCK_M": 32,
            "BLOCK_N": 32
        },
        "num_warps": 1,
        "num_stages": 1
    },
    "4_32_384_torch.float32_torch.float32_torch.float32_torch.float32_torch.float32_torch.float32_torch.float32": {
        "kwargs": {
            "BLOCK_M": 32,
            "BLOCK_N": 32
        },
        "num_warps": 1,
        "num_stages": 1
    }
}