models/tri_attention/TriAttentionCache/1/_attention_fwd_8-0.json
{
    "4_32_384_torch.float32_torch.float32_torch.float32_torch.float32_torch.float32_torch.float32_torch.float32": {
        "kwargs": {
            "BLOCK_M": 32,
            "BLOCK_N": 32
        },
        "num_warps": 1,
        "num_stages": 1
    },
    "4_32_448_torch.float32_torch.float32_torch.float32_torch.float32_torch.float32_torch.float32_torch.float32": {
        "kwargs": {
            "BLOCK_M": 32,
            "BLOCK_N": 32
        },
        "num_warps": 1,
        "num_stages": 1
    },
    "4_32_480_torch.float32_torch.float32_torch.float32_torch.float32_torch.float32_torch.float32_torch.float32": {
        "kwargs": {
            "BLOCK_M": 32,
            "BLOCK_N": 32
        },
        "num_warps": 1,
        "num_stages": 1
    }
}